{
  "batch_id": "batch_20260624_212355",
  "started_at": "2026-06-24T13:25:23Z",
  "finished_at": "2026-06-24T13:33:56Z",
  "timeout": 300,
  "exit_code": 1,
  "remote_log": {
    "host": "t_h20",
    "container": "v0.13.0_torch2.5.1_compile",
    "raw_log_path": "/gpfs/gcsp/M2.7_verify/vllm/ut_logs/batch_20260624_212355/pytest_batch_20260624_212355.log",
    "size_bytes": null,
    "captured_at": "2026-06-24T13:33:56Z"
  },
  "tests": [
    {
      "id": 1,
      "test_node": "tests/benchmarks/test_latency_cli.py::test_bench_latency",
      "status": "retriable_error",
      "error_type": "timeout",
      "error_message": "JUnit XML missing (watchdog SIGKILL or fetch empty)",
      "duration_ms": null,
      "exit_code": 0,
      "gpu_id": 0,
      "log_path": "/gpfs/gcsp/M2.7_verify/vllm/ut_logs/batch_20260624_212355/pytest_batch_20260624_212355_tests_benchmarks_test_latency_cli_py_test_bench_latency.log",
      "xml_path": "/gpfs/gcsp/M2.7_verify/vllm/ut_logs/batch_20260624_212355/result_batch_20260624_212355_tests_benchmarks_test_latency_cli_py_test_bench_latency.xml"
    },
    {
      "id": 2,
      "test_node": "tests/kernels/core/test_mrope.py::test_mrope[11-dtype0-1-model_info0-zai-org/GLM-4.1V-9B-Thinking]",
      "status": "retriable_error",
      "error_type": "timeout",
      "error_message": "JUnit XML missing (watchdog SIGKILL or fetch empty)",
      "duration_ms": null,
      "exit_code": 2,
      "gpu_id": 1,
      "log_path": "/gpfs/gcsp/M2.7_verify/vllm/ut_logs/batch_20260624_212355/pytest_batch_20260624_212355_tests_kernels_core_test_mrope_py_test_mrope_11_dtype0_1_model_info0_zai_org_GLM_4_1V_9B_Thinking.log",
      "xml_path": "/gpfs/gcsp/M2.7_verify/vllm/ut_logs/batch_20260624_212355/result_batch_20260624_212355_tests_kernels_core_test_mrope_py_test_mrope_11_dtype0_1_model_info0_zai_org_GLM_4_1V_9B_Thinking.xml"
    },
    {
      "id": 3,
      "test_node": "tests/kernels/core/test_mrope.py::test_mrope[11-dtype0-1-model_info1-Qwen/Qwen2-VL-7B-Instruct]",
      "status": "retriable_error",
      "error_type": "timeout",
      "error_message": "JUnit XML missing (watchdog SIGKILL or fetch empty)",
      "duration_ms": null,
      "exit_code": 2,
      "gpu_id": 2,
      "log_path": "/gpfs/gcsp/M2.7_verify/vllm/ut_logs/batch_20260624_212355/pytest_batch_20260624_212355_tests_kernels_core_test_mrope_py_test_mrope_11_dtype0_1_model_info1_Qwen_Qwen2_VL_7B_Instruct.log",
      "xml_path": "/gpfs/gcsp/M2.7_verify/vllm/ut_logs/batch_20260624_212355/result_batch_20260624_212355_tests_kernels_core_test_mrope_py_test_mrope_11_dtype0_1_model_info1_Qwen_Qwen2_VL_7B_Instruct.xml"
    }
  ],
  "statistics": {
    "total": 3,
    "passed": 0,
    "failed": 0,
    "error": 0,
    "skipped": 0,
    "retriable_error": 3
  }
}